{
  "task_id": "patch-webhook",
  "class": "patch",
  "root_dirs": ["src", "test"],
  "visible_test_cmd": "npm test",
  "setup_cmd": ["npm ci"],
  "entrypoints": {
    "service": "src/server.ts"
  },
  "critical_requirements": [
    "exactly-once-processing",
    "api-contract-preserved",
    "no-duplicate-ledger-entry"
  ]
}
